Macro Phrase,Macro Text,,,
aorta,Atherosclerotic calcifications of the aorta are present.,,,
appendicitis,"The appendix demonstrates diffuse distention to approximately __ , consistent with acute appendicitis.  There is periappendiceal inflammatory stranding.  No abscess. ",,,
adenitis,"There are multiple small nonspecific lymph nodes in the mesenteric fat of the right lower quadrant, but there are no nodes of pathologic dimensions present. There is otherwise no evidence of bowel inflammation, inflammatory stranding, fluid collections or abscess formation. This nonspecific mesenteric adenitis can be secondary to a variety of bacterial, viral, or other inflammatory processes.",,,
Adeno myoma,"There is lobulated fluid signal intensity in the gallbladder fundus, consistent with adenomyomatosis and suggestive of chronic cholecystitis.",,,
adenoma,"There is a focal hypodense mass in the adrenal gland, consistent in appearance and density with a benign adrenal adenoma.",,,
Adenomatous,There is multilobulated benign adenomatous enlargement of the adrenal glands.,,,
Adenomyomatosis,"There is lobulated fluid density in the gallbladder fundus, consistent with adenomyomatosis and suggestive of chronic cholecystitis.",,,
Adenomyosis,"There is diffuse enlargement of the uterus, suggestive of benign adenomyosis.",,,
adenopathy,There are multiple nonspecific enlarged lymph nodes.,,,
adenopathy axillary,There are multiple enlarged nonspecific axillary lymph nodes.,,,
adenopathy cervical,There are multiple enlarged nonspecific cervical nodes.,,,
adenopathy hilar,There are multiple enlarged nonspecific hilar lymph nodes.,,,
adenopathy inguinal,There are multiple enlarged nonspecific inguinal lymph nodes.,,,
adenopathy mediastinal,There are multiple enlarged nonspecific mediastinal nodes.,,,
adenopathy mediastinum,There are multiple enlarged nonspecific mediastinal nodes.,,,
adenopathy paratracheal,There are multiple enlarged nonspecific paratracheal nodes.,,,
adenopathy periaortic,There are multiple enlarged nonspecific periaortic lymph nodes.,,,
adenopathy periportal,There are multiple enlarged nonspecific periportal lymph nodes.,,,
adenopathy portocaval,There are multiple enlarged portocaval nodes.,,,
adenopathy retroperitoneal,There are multiple enlarged nonspecific retroperitoneal lymph nodes.,,,
adrenal adenoma,"There is a focal hypodense mass in the adrenal gland, consistent in appearance and density with a benign adrenal adenoma.",,,
adrenal adenomatous,There is multilobulated benign adenomatous enlargement of the adrenal glands.,,,
adrenal atrophy,"The adrenal glands demonstrate diffuse atrophy, suggestive of exogenous production or administration of adrenocortical steroids.",,,
Adrenal calcification,The adrenal glands demonstrate punctate calcifications consistent with remote infection.,,,
adrenal enlargement,There is diffuse bilateral nonspecific adrenal enlargement.,,,
age indeterminate,This abnormality is age-indeterminate.,,,
age indeterminate multiple,These abnormalities are age-indeterminate.,,,
age mild,Impression: Age-related cerebral atrophy and mild chronic microvascular ischemic changes.,,,
age moderate,Impression: Age-related cerebral atrophy and moderate chronic microvascular ischemic changes.,,,
age severe,Impression: Age-related cerebral atrophy and extensive chronic microvascular ischemic changes.,,,
air bronchograms,Air bronchograms are visualized within this consolidated region.,,,
Air fluid,There are nonspecific air-fluid levels present.,,,
air trapping,"There is heterogeneous attenuation of the pulmonary parenchyma, consistent with air trapping from underlying small airways disease.",,,
amiodarone,There is increased hepatic parenchymal density consistent with amiodarone therapy.,,,
Ankle ligaments,The anterior and posterior talofibular ligaments are normal. The calcaneofibular ligament is normal. The distal tibial/fibular syndesmosis is not widened. The deep and superficial fibers of the deltoid ligament are normal. The Lisfranc ligament is normal. The plantar fascia and its calcaneal origin are normal.,,,
aorta mild,The aorta demonstrates mild atherosclerotic calcification.,,,
aorta moderate,The aorta demonstrates moderate atherosclerotic calcification.,,,
aorta severe,The aorta demonstrates extensive atherosclerotic calcification.,,,
aortic stent,"There has been a stent graft repair of an abdominal aortic aneurysm. The stent graft limbs are in appropriate position, and there is no evidence of endoleak or other complications.",,,
aortic valve calcs,There is calcification of the aortic valve annulus.,,,
Aortobiliac,There has been placement of an aortobiliac vascular graft.,,,
apical,There is biapical pleural thickening consistent with remote granulomatous organism exposure.,,,
Apical blebs,There are multiple subpleural blebs in the lung apices.,,,
apices,The visualized portions of the lung apices are normal.,,,
appendectomy,There has been an appendectomy.,,,
Appendiceal stump,A normal short appendix or appendiceal stump is identified.,,,
appendicitis mild,"The appendix demonstrates mild diffuse distention to approximately __ , consistent with acute appendicitis.  There is mild periappendiceal inflammatory stranding.  No abscess. ",,,
appendicitis moderate,"The appendix demonstrates moderate diffuse distention to approximately __ , consistent with acute appendicitis.  There is moderate periappendiceal inflammatory stranding.  No abscess. ",,,
Appendicolith,There is a focal intraluminal appendiceal calcification.,,,
appendix,A normal appendix is identified.,,,
asbestos,There are diaphragmatic and pleural calcifications consistent with remote asbestos exposure.,,,
ascites small,There is a small amount of free intraperitoneal fluid present.,,,
atelectasis,There is minimal bibasilar atelectasis.,,,
atlantoaxial degenerative,Atlantoaxial joint degenerative changes are present. There is calcification of the transverse ligament compatible with CPPD arthropathy.,,,
atrophy,"There is diffuse cerebral atrophy present, consistent with this patient's age.",,,
Avascular necrosis,"There is a focus of geographic signal abnormality with serpiginous peripheral sclerosis in the subchondral femoral head, consistent with avascular necrosis.",,,
Avez Rizvi's Commands,"The spine, sacroiliac joints, and hip joints are normal.",,,
bases,The visualized portions of the lung bases are normal.,,,
Bibasilar,There is bibasilar subsegmental atelectasis.,,,
bilateral lens,There have been bilateral intraocular lens replacements.,,,
bladder,The bladder is normal.,,,
bladder air,There is a small amount of intraluminal air consistent with instrumentation.,,,
Bladder artifact,The bladder is obscured by arthroplasty artifact.,,,
Bladder calcifications,There are multiple calcified uroliths in the bladder.,,,
Bladder contracted,The bladder is decompressed but otherwise normal.,,,
Bladder decompressed,The bladder is decompressed but otherwise normal.,,,
Bladder distended,The bladder is distended.,,,
Bladder diverticula,There are benign bladder diverticula.,,,
Bladder diverticulum,There is a benign bladder diverticulum.,,,
Bladder outlet,The bladder demonstrates diffuse wall thickening consistent with chronic outlet obstruction.,,,
blastic,"There are extensive blastic lesions throughout all of the visualized skeletal structures, consistent with metastatic disease.",,,
blebs,There are multiple subpleural blebs in the lung apices.,,,
bone island,There is a benign bone island.,,,
Both arteries,"Impression: No evidence of significant stenosis, aneurysmal dilatation, or dissection involving the arteries of the head and neck.",,,
Bowel decompressed,There is bowel wall thickening related to incomplete distention.,,,
Bowel nonspecific,There is nonspecific bowel wall thickening. This may be related to incomplete distention.,,,
bowel resection,There are multiple surgical clips consistent with previous bowel resection and reanastomosis.,,,
bypass,"Sternotomy wires and mediastinal surgical clips are present, consistent with previous coronary arterial bypass grafting.",,,
cardiomegaly,The heart demonstrates diffuse enlargement.,,,
cardiomegaly mild,The heart demonstrates mild diffuse enlargement.,,,
cardiomegaly moderate,The heart demonstrates moderate diffuse enlargement.,,,
cardiomegaly severe,The heart demonstrates marked diffuse enlargement.,,,
cast,Overlying cast material obscures fine bone detail and soft tissue evaluation.,,,
cavum septum,There is a normal-variant cavum septum pellucidum.,,,
cervical degenerative,"There are degenerative changes with osteophyte formation, mild facet hypertrophic changes, disc space narrowing, and minimal endplate sclerosis.  There is no evidence of significant spinal canal stenosis.",,,
cervical mild,The cervical spine demonstrates mild degenerative changes at multiple levels.,,,
cervical moderate,The cervical spine demonstrates moderate degenerative changes at multiple levels.,,,
cervical severe,The cervical spine demonstrates extensive degenerative changes at multiple levels.,,,
cervical shotty,There are numerous prominent but non-pathologic lymph nodes in the posterior cervical triangle. There are no nodes of pathologic dimensions.,,,
cholecystectomy,There has been a cholecystectomy.,,,
cholecystectomy duct,"There is a mild, expected degree of intrahepatic and common bile duct dilation.",,,
cholelithiasis,Multiple calcified gallstones are present in the gallbladder.,,,
Chronic L5,There are bilateral chronic L5 pars interarticularis defects.,,,
cirrhosis,"There is a finely nodular contour to the liver and hypertrophy of the caudate lobe, consistent with end-stage cirrhosis.",,,
cirrhosis ultrasound,"There is a diffuse coarse hyperechoic appearance to the liver parenchyma, consistent with cirrhosis.",,,
cisterna,There is a normal benign mega cisterna magna.,,,
click adrenal,The adrenal glands are normal.,,,
click adrenals,The adrenal glands are normal.,,,
click bowel,There is no evidence of intestinal perforation or obstruction.,,,
click by malleolar,Bimalleolar soft tissue swelling is present.,,,
associated,There is associated periureteral and perinephric fat stranding.,,,
calculi,There are bilateral nonobstructing renal calculi.,,,
ascites medium,There is a moderate amount of free intraperitoneal fluid present.,,,
ascites severe,There is a large amount of free intraperitoneal fluid present.,,,
low grade,There are multiple fluid-filled loops of small bowel and colon noted throughout the abdomen and pelvis. There is no frank dilatation or obstruction. Findings are compatible with low grade enterocolitis.,,,
click Cervical lordosis,"Impression: Straightening of the normal cervical lordosis, which can be seen on the basis of patient positioning versus muscle spasm.",,,
click common,The common bile duct is not dilated.,,,
click dish,There are diffuse enthesopathic changes consistent with benign diffuse idiopathic skeletal hyperostosis (DISH).,,,
click flow,There is normal vascular flow.,,,
click Hallux valgus mild,There is mild hallux valgus deformity.,,,
click Hallux valgus moderate,There is moderate hallux valgus deformity.,,,
click Hallux valgus severe,There is marked hallux valgus deformity.,,,
click hardware,Surgical instrumentation is in appropriate position and shows no evidence of complications.,,,
Click hydro,"There is no evidence of hydronephrosis, masses, or stones.",,,
click Interval improvement,This demonstrates interval improvement compared to the prior study.,,,
click Interval progression,This demonstrates interval progression compared to the prior study.,,,
click jets,Bilateral ureteral jets are identified.,,,
click kidney cortical,"There is diffuse bilateral renal cortical thinning, consistent with chronic renal insufficiency.",,,
click liver,There are no focal liver lesions present.,,,
click lumbar,The lumbar spine is normal.,,,
click Lumbar postoperative,Postoperative changes are present in the lumbar spine.,,,
click lungs,The lungs are normal.,,,
click multiple,Impression: Multiple other nonacute findings as described above.,,,
click muscle,The muscles and soft tissues show no evidence of abnormal signal intensity to suggest injury or inflammation.,,,
click nodule,"As per Fleischner Society Guidelines, followup is recommended in 6-12 months.",,,
click pancreas,The pancreas is normal.,,,
click report,A report from a CT scan of the dated was available for review.  No images were available for review.,,,
click resection,There are multiple surgical clips consistent with previous bowel resection and reanastomosis.,,,
click sinuses,The sinuses are normal.,,,
click soft tissues,The soft tissues are unremarkable.,,,
click spine,The spine is normal.,,,
click spleen,The spleen is normal.,,,
click thoracolumbar moderate,The visualized thoracolumbar spine demonstrates moderate degenerative changes at multiple levels.,,,
Click thoracolumbar severe,The visualized thoracolumbar spine demonstrates extensive degenerative changes at multiple levels.,,,
click upper abdomen,"The visualized portions of the liver, pancreas, adrenal glands, and spleen show no significant abnormalities.",,,
click vascular,The vasculature is normal.,,,
condensans,Benign osteitis condensans ilii is present.,,,
congestive,There is mild intralobular septal thickening and interstitial prominence with associated mild diffuse hazy groundglass opacification consistent with congestive changes.,,,
Contained perforation,"There are small foci of peri-intestinal air, consistent with a small contained intestinal perforation.",,,
copious,There is a large amount of stool noted throughout the colon. Correlate for history of constipation.,,,
brain moderate,"There are patchy areas of diminished attenuation seen within the periventricular and subcortical white matter compatible with moderate chronic microvascular ischemic changes.There is diffuse cerebral atrophy present, consistent with this patient's age.There is no evidence of intracranial hemorrhage. There is no evidence of acute ischemia. There is no evidence of intracranial extra-axial fluid collections. There is no mass-effect or midline shift.",,,
brain severe,"There are patchy areas of diminished attenuation seen within the periventricular and subcortical white matter compatible with extensive chronic microvascular ischemic changes.There is diffuse cerebral atrophy present, consistent with this patient's age.There is no evidence of intracranial hemorrhage. There is no evidence of acute ischemia. There is no evidence of intracranial extra-axial fluid collections. There is no mass-effect or midline shift.",,,
granulomas,There are multiple pulmonary parenchymal calcifications consistent with remote granulomatous organism exposure.,,,
COPD,There prominent interstitial markings in a background of radiolucency in flattening of the hemidiaphragms compatible with COPD.,,,
motion,"There is motion artifact, which makes evaluation suboptimal.",,,
thoracolumbar mild,The visualized thoracolumbar spine demonstrates mild degenerative changes at multiple levels.,,,
viral,There is mild perihilar interstitial prominence consistent with viral bronchiolitis.,,,
remaining,The remaining paranasal sinuses and mastoid air cells are clear.,,,
cholecystitis,"There is diffuse gallbladder wall thickening and edema, pericholecystic inflammatory changes, and gallbladder distenstion consistent with acute cholecystitis. Correlate with Murphy's sign.  Futher characterization with right upper quadrant ultrasound can be obtained if clinically warranted.  ",,,
click obstruction,"There are multiple dilated loops of small bowel with internal air-fluid levels and a transition point along the __ (series, __ , image __ ). Findings are consistent with small bowel obstruction.",,,
coronary mild,There is mild atherosclerotic calcification of the coronary arteries.,,,
coronary moderate,There is moderate atherosclerotic calcification of the coronary arteries.,,,
coronary severe,There is extensive atherosclerotic calcification of the coronary arteries.,,,
covid high,"High confidence features for COVID-19 (in the appropriate clinical setting). Although other processes can cause a similar pattern, consider viral testing for confirmation or exclusion of this possibility.",,,
covid intermediate,"Intermediate confidence features for COVID-19 in the appropriate clinical setting. However, the findings are nonspecific, and other infectious or noninfectious processes can cause the same pattern.",,,
covid low,"Low confidence features for COVID-19 associated pneumonia. In the absence of specific clinical context, the findings are less likely to be secondary to COVID-19 pneumonia.",,,
COVID PE,"There are bilateral patchy groundglass airspace opacities, which are extending to the periphery.  This is an a pattern of distribution most consistent with COVID-19 infection.No filling defect is identified within the main, segmental, or subsegmental pulmonary arteries to suggest pulmonary embolism.Impression: Findings consistent with COVID\ufffd19 infection as described above.  No evidence of acute pulmonary embolism.",,,
CPPD,"There is chondrocalcinosis, consistent with calcium pyrophosphate deposition arthropathy.",,,
cysticercosis,There are punctate cortical calcifications consistent with remote cysticercosis exposure.,,,
Degenerative,Degenerative changes of the thoracic spine are present.,,,
Delayed bladder,High density contrast material is noted within the bilateral collecting systems and layering within the urinary bladder on delayed phase imaging.,,,
demineralized,The osseous structures are demineralized.,,,
Dialysis,A dialysis catheter is noted with its tip within the right atrium.,,,
Diminished,"There is poor ventilation of the lungs, with perihilar vascular crowding and a diffuse increase in pulmonary parenchymal density.",,,
Diverticula scattered,There are scattered colonic diverticula without CT evidence of diverticulitis.,,,
drain,A surgical drain is present.,,,
Empty sella,There is a normal empty pituitary sella.,,,
endometrium,The endometrium is normal.,,,
endotracheal,"An endotracheal tube is present, lying with its tip above the carina.",,,
Esophageal varices,There are small dilated periesophageal vessels consistent with varices.,,,
eye calcifications,There is senile calcification of the eye muscle tendon insertions.,,,
eye you dee,An intrauterine device is present.,,,
falx calcifications,There is benign calcification of the falx cerebri.,,,
Fatty liver,"There is a diffuse decrease in hepatic parenchymal density, consistent with fatty infiltration.",,,
fecalith,There is a focal intraluminal appendiceal calcification.,,,
feeding tube,A feeding tube is noted coursing below the level of the diaphragm in appropriate position.,,,
fibroid,There is a single benign fibroid in the uterus.,,,
fibroid multiple,There are multiple benign fibroids in the uterus.,,,
filter,An IVC filter is present.,,,
fluid moderate,There is a moderate amount of free fluid present.,,,
fluid small,There is a small amount of free fluid present.,,,
Foley,The bladder is decompressed by a Foley catheter but is otherwise normal. There is a small amount of intraluminal air consistent with instrumentation.,,,
gallbladder,The gallbladder is normal.,,,
Gallbladder contracted,The gallbladder is contracted but otherwise normal.,,,
Gallbladder decompressed,The gallbladder is contracted but otherwise normal.,,,
Gallbladder distended,The gallbladder is distended.,,,
Gallbladder echogenic,"There is a single echogenic focus in the gallbladder, consistent with an adherent noncalcified stone or polyp.",,,
Gallbladder nonspecific,There is diffuse nonspecific submucosal edema of the gallbladder wall.,,,
left glenohumeral,The left glenohumeral joint is normal.,,,
diverticulitis mild,"There is a segment of wall thickening at the junction of the sigmoid and descending colon, consistent with mild acute diverticulitis. There is mild pericolonic inflammatory stranding.",,,
diverticulosis severe,Extensive diverticulosis is present in the sigmoid and descending colon.,,,
diverticulitis,"There is a segment of wall thickening at the junction of the sigmoid and descending colon, consistent in appearance with acute diverticulitis.",,,
cystitis,There is diffuse bladder wall thickening compatible with cystitis. Correlate with urinalysis.,,,
diverticulitis moderate,"There is a segment of wall thickening at the junction of the sigmoid and descending colon, consistent with moderate acute diverticulitis. There is moderate pericolonic inflammatory stranding.",,,
diveticulitis severe,"There is a segment of wall thickening at the junction of the sigmoid and descending colon, consistent with severe acute diverticulitis. There is marked pericolonic inflammatory stranding.",,,
fluid large,There is a large amount of free intraperitoneal fluid present.,,,
Gallbladder polyp,"There is a small focus of echogenicity in the gallbladder, consistent with an adherent noncalcified stone or polyp.",,,
gastric bypass,There has been a gastric stapling and bypass.,,,
gastric tube,A gastric feeding tube is in appropriate position.,,,
gluteal calcifications,Calcified injection granulomas are noted in the subcutaneous tissues of the bilateral gulteal regions.,,,
goiter,"There is diffuse enlargement of the thyroid gland, consistent with a goiter.",,,
granuloma,There is a pulmonary parenchymal calcification consistent with remote granulomatous organism exposure.,,,
Gynecomastia,There is nonspecific gynecomastia.,,,
hammertoes,Multiple hammertoe deformities are present.,,,
hepatic calcifications,"The liver demonstrates punctate calcifications, consistent with remote granulomatous organism exposure.",,,
hepatic cyst,There is a simple hepatic cyst.,,,
hepatic mets,"There are multiple heterogeneous hypodense liver masses, consistent in appearance with metastatic disease.",,,
hepatic polycystic,There are multiple simple hepatic cysts.,,,
hepatic single,"There is a subcentimeter hypodensity within the left hepatic lobe, which is too small to characterize.",,,
hepatic subcentimeter,There are focal liver subcentimeter hypodensities that cannot be further characterized on the current examination.,,,
hepatomegaly mild,There is diffuse mild enlargement of the liver.,,,
hepatomegaly moderate,There is diffuse moderate enlargement of the liver.,,,
hepatomegaly severe,There is diffuse marked enlargement of the liver.,,,
hiatal small,A small hiatal hernia is present.,,,
hilar adenopathy,There are multiple enlarged nonspecific hilar lymph nodes.,,,
Horseshoe kidney,There is a normal-variant horseshoe kidney.,,,
hydro left,"There is mild left-sided hydroureteronephrosis secondary to an obstructing __ calculus within the __ (series __ , image __ ).  There is associated periureteral and perinephric fat stranding.  Both.",,,
hydro right,"There is mild right-sided hydroureteronephrosis secondary to an obstructing __ calculus within the __ (series __ , image __ ).  There is associated periureteral and perinephric fat stranding.  Both.",,,
hyperostosis,Benign hyperostosis frontalis is present.,,,
hysterectomy,There has been a hysterectomy. No adnexal cysts or masses are identified.,,,
IJ,A right-sided IJ catheter is noted with its tip within the superior vena cava.,,,
IJ Introducer,A right-sided IJ introducer catheter is noted with its tip within the superior vena cava.,,,
Impression,Impression:,,,
inguinal,There is a nonobstructing inguinal hernia.,,,
inguinal adenopathy,There are multiple enlarged nonspecific inguinal lymph nodes.,,,
inguinal shotty,There are numerous prominent but non-pathologic lymph nodes in the inguinal regions. There are no nodes of pathologic dimensions.,,,
Insert benign calcs,Characteristically benign calcifications are noted within the bilateral breasts.,,,
instrumentation,Surgical instrumentation is in appropriate position and shows no evidence of complications.,,,
interphalangeal,There are interphalangeal joint degenerative changes with narrowing and subchondral sclerosis.,,,
Interstitial,There are bilateral nonspecific prominent interstitial markings.,,,
Interstitial congestive,"There are bilateral nonspecific prominent interstitial markings with diffuse ground-glass opacity, which may reflect congestive changes.",,,
interstitial mild,There is diffuse mild nonspecific prominence of the subpleural pulmonary interstitium.,,,
interstitial moderate,There is diffuse moderate nonspecific prominence of the subpleural pulmonary interstitium.,,,
interstitial severe,There is diffuse marked nonspecific prominence of the subpleural pulmonary interstitium.,,,
intracranial arteries,"Impression: No evidence of significant stenosis, aneurysmal dilatation, or dissection involving the arteries of the head.",,,
intrahepatic mild,There is mild dilation of the intrahepatic biliary ducts.,,,
intrahepatic moderate,There is moderate dilation of the intrahepatic biliary ducts.,,,
intrahepatic severe,There is extensive dilation of the intrahepatic biliary ducts.,,,
IUD,An intrauterine device is present.,,,
kidney nonspecific,Bilateral perirenal fat stranding is nonspecific.,,,
kidneys,The kidneys are normal.,,,
knee arthroplasty,There has been a knee arthroplasty with patellar resurfacing.,,,
Kyphosis,There is exaggeration of the normal thoracic kyphosis.,,,
left adenoma,"There is a focal hypodense mass in the left adrenal gland, consistent in appearance and density with a benign adrenal adenoma.",,,
left adrenal,The left adrenal gland is normal.,,,
left adrenal adenoma,"There is a focal hypodense mass in the left adrenal gland, consistent in appearance with a benign adrenal adenoma.",,,
left arthroplasty,There has been a left total hip arthroplasty.,,,
