Macro Phrase,Macro Text,,,
Left avascular necrosis,"There is a focus of geographic signal abnormality with serpiginous peripheral sclerosis in the subchondral left femoral head, consistent with avascular necrosis.",,,
Left corpus,"There is an irregular cystic lesion in the left ovary, consistent with a corpus luteum.",,,
left effusion,There is a left pleural effusion.,,,
gallstone,A calcified gallstone is present.,,,
hiatal large,A large hiatal hernia is present.,,,
hiatal moderate,A moderate hiatal hernia is present.,,,
left glenohumeral mild,There are mild degenerative changes in the left glenohumeral joint.,,,
left glenohumeral moderate,There are moderate degenerative changes in the left glenohumeral joint.,,,
left glenohumeral severe,There are severe degenerative changes in the left glenohumeral joint.,,,
left hepatic cyst,There is a simple left lobe hepatic cyst.,,,
left hilar adenopathy,There are multiple nonspecific enlarged left hilar lymph nodes.,,,
Left hip arthroplasty,There has been a left total hip arthroplasty.,,,
Left hip mild,There are mild degenerative changes in the left hip joint.,,,
Left hip moderate,There are moderate degenerative changes in the left hip joint.,,,
Left hip severe,There are marked degenerative changes in the left hip joint.,,,
left inguinal,There is a nonobstructing left inguinal hernia.,,,
left kidney,The left kidney is normal.,,,
left kidney cyst,There is a simple cyst in the left kidney.,,,
Left kidney infarct,"There is a focal cortical defect in the left kidney, consistent with remote infarction.",,,
Left kidney malrotation,The left kidney is malrotated.,,,
Left kidney scar,"There is a focal cortical defect in the left kidney, representing remote infection or infarction.",,,
left knee arthroplasty,There has been a left knee arthroplasty with patellar resurfacing.,,,
left mastectomy,There has been a left mastectomy.,,,
Left mastoidectomy,There has been a left mastoidectomy.,,,
left maxillary chronic,"There is diffuse mucoperiosteal thickening in the left maxillary sinus, consistent with chronic sinusitis.",,,
left nephrectomy,There has been a left nephrectomy.,,,
left ovarian cyst,There is a simple cyst in the left ovary.,,,
left ovarian polycystic,There are multiple simple left ovarian cysts.,,,
left ovary,The left ovary is normal.,,,
left ovary cyst,There is a simple cyst in the left ovary.,,,
Left parapelvic,There are small benign left parapelvic cysts.,,,
left perinephric,There is inflammatory left perinephric stranding.,,,
left polycystic,There are multiple simple left renal cysts.,,,
left renal cortical,"There is a small focal cortical defect in the left kidney, representing remote infection or infarction.",,,
left renal cyst,There is a simple cyst in the left kidney.,,,
left renal polycystic,There are multiple simple left renal cysts.,,,
Left renal scar,"There is a focal cortical defect in the left kidney, representing remote infection or infarction.",,,
left renal stent,There is a left ureteral stent with its coiled ends appropriately positioned in the left collecting system and bladder.,,,
Left ribs healed,There are healed left rib fractures.,,,
Left subcentimeter,"A subcentimeter hypodensity within the left kidney is too small to characterize, but statistically represents a renal cyst.",,,
left thalamus,"There is a focal hypodensity in the left thalamus, consistent with a remote lacunar infarction.",,,
left thyroid adenoma,"There is a focal hypodense lesion in the left thyroid lobe, consistent with a thyroid adenoma or carcinoma. Correlation with laboratory values and nuclear medicine scan is recommended if clinically warranted.",,,
Lens replacement,There is asymmetric density of the lenses consistent with intraocular lens prosthesis.,,,
ligation,There has been a tubal ligation.,,,
limbus,"There is developmental deformity of the anterior/superior vertebral body, consistent with a benign limbus vertebra.",,,
linear,Linear scarring or atelectasis is present in both lung bases.,,,
liver calcifications,"The liver demonstrates punctate calcifications, consistent with remote granulomatous organism exposure.",,,
liver cirrhosis,"There is a finely nodular contour to the liver and hypertrophy of the caudate lobe, consistent with end-stage cirrhosis.",,,
liver cyst,There is a simple hepatic cyst.,,,
liver metastases,"There are multiple heterogeneous hypodense liver masses, consistent in appearance with metastatic disease.",,,
liver polycystic,There are multiple simple hepatic cysts.,,,
Low lung volumes,"There is poor ventilation of the lungs, accounting for mild diffuse increase in pulmonary parenchymal density.",,,
lumbar mild,The lumbar spine demonstrates mild degenerative changes at multiple levels.,,,
lumbar moderate,The lumbar spine demonstrates moderate degenerative changes at multiple levels.,,,
lumbar severe,The lumbar spine demonstrates marked degenerative changes at multiple levels.,,,
macro_name,macro_text,,,
marrow prominent,"There is diffuse prominence of the hematopoietic bone marrow, disproportionate for this patient's age. This can represent the effects of chronic anemia, smoking, pharmacologic marrow stimulating factors, and infiltrating processes such as lymphoma or leukemia. Clinical correlation is recommended.",,,
maxillary chronic,"There is diffuse mucoperiosteal thickening in the maxillary sinuses, consistent with chronic sinusitis.",,,
maxillary hemorrhage,"There is high density fluid within the maxillary sinuses, consistent with hemorrhage.",,,
mediastinal,"The mediastinal structures including the esophagus, trachea, great vessels, and heart show no evidence of injury or acute pathologic processes.",,,
right ovary,The right ovary is normal.,,,
mediastinal adenopathy,There are multiple enlarged nonspecific mediastinal nodes.,,,
mediastinal calcifications,"There are multiple small calcified lymph nodes in the mediastinum, consistent with remote granulomatous organism exposure.",,,
mediastinal shotty,There are numerous prominent but non-pathologic lymph nodes in the mediastinum. There are no nodes of pathologic dimensions.,,,
mediastinum,"The mediastinal structures including the esophagus, trachea, great vessels, and heart show no evidence of injury or acute pathologic processes.",,,
mediastinum shotty,There are numerous prominent but non-pathologic lymph nodes in the mediastinum. There are no nodes of pathologic dimensions.,,,
mega,There is a normal benign mega cisterna magna.,,,
mega cisterna,There is a normal benign mega cisterna magna.,,,
mega cisterna magna,There is a normal benign mega cisterna magna.,,,
mesenteric adenitis impression,"This nonspecific mesenteric adenitis can be secondary to a variety of bacterial, viral, or other inflammatory processes.",,,
mesenteric adenopathy,There are multiple enlarged nonspecific mesenteric lymph nodes.,,,
mesenteric shotty,There are multiple nonspecific nonpathologic but prominent lymph nodes in the mesentery. There are no mesenteric lymph nodes of pathologic dimensions.,,,
mesh,The patient is post anterior abdominal wall hernia repair with mesh placement.,,,
mild head,Impression: Mild chronic microvascular ischemic changes.,,,
misty mesentery,There are multiple nonspecific nonpathologic but prominent lymph nodes in the mesentery. There are no mesenteric lymph nodes of pathologic dimensions. There is a diffuse inflammatory stranding throughout the central mesentery as well.,,,
mitral valve,There is calcification of the mitral valve annulus.,,,
Moderate head,Impression: Moderate chronic microvascular ischemic changes.,,,
MRI Head Normal,"There are no cerebral, cerebellar, or mid brain parenchymal signal abnormalities. There is no acute mass effect, midline shift, or hemorrhage. No extra-axial fluid collections are identified. There is no pathologic intracranial enhancement. There is no diffusion abnormality to suggest acute/subacute infarct. The major intracranial flow voids at the skull base are maintained. The globes and orbits are grossly within normal limits. Limited evaluation of the paranasal sinuses and bilateral mastoid complexes are within normal limits. There is no bone marrow signal abnormality. The sella is unremarkable.",,,
MRI Old head,There are scattered punctate foci of T2 and FLAIR hyperintensities in the bilateral frontal and parietal periventricular and subcortical white matter which are nonspecific and without mass effect most likely consistent with chronic small vessel ischemic changes in a patient of this stated age.,,,
mucous retention,There is a benign mucous retention cyst.,,,
Murphy's,A positive sonographic Murphy's sign was not elicited.,,,
nasogastric,A nasogastric tube lies with its tip in the gastric antrum.,,,
Neck arteries,"Impression: No evidence of significant stenosis, aneurysmal dilatation, or dissection involving the arteries of the neck.",,,
no abdomen,Impression: No evidence of acute intra-abdominal pathology.,,,
No abdomen aorta,No evidence of acute aneurysmal dilatation or dissection of the aorta or arterial branches.,,,
no abscess,There is no evidence of focal fluid collections to suggest abscess formation.,,,
no adenopathy,There is no evidence of lymphadenopathy.,,,
no appendicitis,A normal appendix is identified. There is no evidence of distention or periappendiceal inflammation to suggest appendicitis.,,,
no appendix,No appendix is specifically identified. There is no evidence of fluid collections or inflammatory stranding in the right lower quadrant.,,,
no chest,Impression: No acute cardiopulmonary disease.,,,
no common,There is no common bile duct dilation.,,,
No DVT,Impression: No evidence of deep venous thrombosis within the,,,
no extravasation,There is no evidence of active contrast extravasation.,,,
no face,Impression: No evidence of acute maxillofacial fracture.,,,
no fracture,Impression: No evidence of acute fracture or dislocation involving the,,,
no gestational,An intrauterine gestational sac is not identified.,,,
No Head,Impression: No acute intracranial hemorrhage or ischemic change.,,,
No hydro,No evidence of bilateral hydroureteronephrosis or obstructing renal or ureteral calculi.,,,
no intracranial,There is no evidence of intracranial hemorrhage.There is no evidence of acute ischemia.There is no evidence of intracranial extra-axial fluid collections.There is no mass-effect or midline shift.,,,
no jets,Ureteral jets are not identified.,,,
no left ovary,The left ovary is not visualized.,,,
no neck,Impression: No evidence of acute findings within the soft tissues of the neck.,,,
no orbit,There is no evidence of retro-bulbar hemorrhage. There is no evidence of globe or lens injury.,,,
mesenteric adenitis,"There are multiple small nonspecific lymph nodes in the mesenteric fat of the right lower quadrant, but there are no nodes of pathologic dimensions present. There is otherwise no evidence of bowel inflammation, inflammatory stranding, fluid collections or abscess formation. Findings are consistent with mesenteric adenitis.",,,
No filling defect,"No filling defect is identified within the main, segmental, or subsegmental pulmonary arteries to suggest pulmonary embolism.",,,
no osseous,No significant skeletal abnormalities are identified.,,,
no pancreas,The pancreas is poorly-visualized due to overlying bowel gas.,,,
No PE,Impression: No evidence of acute pulmonary embolism or other acute intrathoracic pathology.,,,
no pericholecystic,There is no evidence of pericholecystic fluid.,,,
no pseudocyst,There is no evidence of focal fluid collection to suggest pseudocyst or abscess formation.,,,
no right ovary,The right ovary is not visualized.,,,
no shift,There is no significant ventricular effacement or midline shift.,,,
no skeletal,No significant skeletal abnormalities are identified.,,,
no spinal,There is no evidence of significant spinal canal stenosis.,,,
No subluxation,Impression: No evidence of acute fracture or subluxation involving the,,,
no thoracic aortic,No evidence of acute intrathoracic aortic aneurysmal dilatation or dissection. No evidence of pulmonary embolism.,,,
no trauma,Impression: No evidence of acute intrathoracic or intra-abdominal injury or other acute pathology.,,,
node,There is a single enlarged nonspecific lymph node.,,,
occult head,"Please note, early findings of acute ischemia can be occult on CT head. If there is high clinical concern for ischemia, an MRI can be obtained with diffusion-weighted imaging.",,,
old fibroids,"There are fibroids noted within the uterus, some of which are calcified and degenerated.",,,
old head mild,There are patchy areas of diminished attenuation seen within the periventricular and subcortical white matter compatible with mild chronic microvascular ischemic changes.,,,
old head moderate,There are patchy areas of diminished attenuation seen within the periventricular and subcortical white matter compatible with moderate chronic microvascular ischemic changes.,,,
old head severe,There are patchy areas of diminished attenuation seen within the periventricular and subcortical white matter compatible with extensive chronic microvascular ischemic changes.,,,
old maid,"There is bronchiectasis in the lingula and medial right middle lobe, suggestive of chronic mycobacterium avium intracellulare colonization.",,,
orbits,The orbits are normal.,,,
os peroneus,There is a benign os peroneus accessory ossicle.,,,
Os trigonum,There is a normal accessory os trigonum accessory ossicle.,,,
oss tibiale,There is an accessory os tibiale externum.,,,
osteopenia,The osseous structures are demineralized.,,,
osteophytosis mild,There is mild degenerative osteophytosis.,,,
osteophytosis moderate,There is moderate degenerative osteophytosis.,,,
osteophytosis severe,There is marked degenerative osteophytosis.,,,
other findings,"Impression: Other, nonacute findings as described above.",,,
outlet obstruction,The bladder demonstrates diffuse wall thickening consistent with chronic outlet obstruction.,,,
ovaries,The ovaries are normal.,,,
ovary cyst left,There is a simple cyst in the left ovary.,,,
ovary cyst right,There is a simple cyst in the right ovary.,,,
ovary polycystic,There are multiple simple ovarian cysts.,,,
pacemaker,"A pacemaker device is present, and its leads are in appropriate position.",,,
pancreas atrophy,There is diffuse atrophy of the pancreatic parenchyma.,,,
pancreas calcifications,"There are punctate pancreatic parenchymal calcifications, consistent with chronic pancreatitis.",,,
pancreas fatty,"There is diffuse, benign fatty infiltration of the pancreas.",,,
pancreatitis,"There is diffuse peripancreatic inflammatory stranding and fluid, consistent with acute pancreatitis.",,,
pancreatitis mild,"There is mild diffuse peripancreatic inflammatory stranding and fluid, consistent with mild acute pancreatitis.",,,
pancreatitis moderate,"There is moderate diffuse peripancreatic inflammatory stranding and fluid, consistent with moderate acute pancreatitis.",,,
pancreatitis severe,"There is marked diffuse peripancreatic inflammatory stranding and fluid, consistent with severe acute pancreatitis.",,,
paravertebral,The paravertebral soft tissues are unremarkable.,,,
pectus,There is a moderate pectus excavatum deformity of the anterior chest wall.,,,
pelvic dissection,"Multiple surgical clips are present in the pelvis, consistent in appearance with previous pelvic lymph node dissection.",,,
pelvic fluid,"A small amount of free fluid is noted within the pelvis, which is likely physiologic.",,,
periaortic adenopathy,There are multiple enlarged nonspecific periaortic lymph nodes.,,,
periaortic shotty,"There are multiple small nonspecific lymph nodes in the periaortic region, but there are no nodes of pathologic dimensions present.",,,
periappendiceal large,There is a large amount of periappendiceal fluid and inflammatory stranding.,,,
periappendiceal mild,There is mild periappendiceal inflammatory stranding.,,,
periappendiceal moderate,There is moderate periappendiceal inflammatory stranding.,,,
periappendiceal severe,There is marked periappendiceal inflammatory stranding.,,,
pericardial large,There is a large pericardial effusion present.,,,
pericardial moderate,There is a moderate pericardial effusion present.,,,
pericardial small,There is a small pericardial effusion present.,,,
pericholecystic,There is pericholecystic fluid.,,,
pericolonic,There is pericolonic inflammatory stranding.,,,
periportal,There is periportal edema.,,,
periportal mild,There is mild periportal edema.,,,
phleboliths,There are numerous benign phleboliths in the pelvis.,,,
Plantar fasciitis severe,The plantar fascia origin demonstrates marked inflammatory signal abnormality with plantar fasciitis.,,,
polycystic,There are multiple simple renal cysts.,,,
porcelain,"There is linear calcification in the gallbladder wall, consistent with porcelain gallbladder and indicative of an increased risk of gallbladder carcinoma.",,,
portal caval adenopathy,There are multiple enlarged nonspecific portocaval lymph nodes.,,,
pregnancy,A single intrauterine pregnancy is present.,,,
prelim,This report constitutes a preliminary interpretation only. Nonacute findings felt to be unrelated to clinical presentation may not be discussed in this report. The study will be interpreted and a final report will be generated by the local radiologist the following shift.,,,
prostate,The prostate gland and seminal vesicles are normal.,,,
prostate calcifications,The prostate gland demonstrates nonspecific parenchymal calcifications.,,,
prostate mild,The prostate gland demonstrates mild nonspecific enlargement. The seminal vesicles are normal.,,,
prostate moderate,The prostate gland demonstrates moderate nonspecific enlargement. The seminal vesicles are normal.,,,
Prostate seeds,There are multiple hyperdense radiation seeds within the prostate parenchyma.,,,
prostate severe,The prostate gland demonstrates marked nonspecific enlargement. The seminal vesicles are normal.,,,
prostatectomy,There has been a prostatectomy.,,,
pulmonary limited,Evaluation for pulmonary embolism is limited secondary to the lack of contrast opacification within the bilateral segmental and subsegmental pulmonary arteries. No definite filling defect is identified within the main and immediate right and left pulmonary arteries. The proximal segmental and subsegmental arteries cannot be evaluated on this study.,,,
Pulmonary Suboptimal,"Please note, this study is suboptimal for the evaluation of pulmonary embolism to to lack of contrast opacification within the subsegmental arteries of the bilateral pulmonary arteries. No filling defect is identified within the main or immediate segmental branches. The subsegmental branches cannot be evaluated on this study.",,,
renal cortical,"There is diffuse bilateral renal cortical thinning, consistent with chronic renal insufficiency.",,,
renal cyst,There is a simple cyst in the kidney.,,,
renal nonspecific,Bilateral perirenal fat stranding is nonspecific.,,,
reversal,"There is a reversal of the normal lordosis, related to positioning or spasm.",,,
right adenoma,"There is a focal hypodense mass in the right adrenal gland, consistent in appearance with a benign adrenal adenoma.",,,
right adrenal,The right adrenal gland is normal.,,,
right arthroplasty,There has been a right total hip arthroplasty.,,,
Right avascular necrosis,"There is a focus of geographic signal abnormality with serpiginous peripheral sclerosis in the subchondral right femoral head, consistent with avascular necrosis.",,,
right corpus,"There is an irregular cystic lesion in the right ovary, consistent with a corpus luteum.",,,
Right corpus luteum,"There is an irregular cystic lesion in the right ovary, consistent with a corpus luteum.",,,
right cyst,There is a simple cyst in the right kidney.,,,
right effusion,There is a right pleural effusion.,,,
right glenohumeral,The right glenohumeral joint is normal.,,,
right glenohumeral mild,There are mild degenerative changes in the right glenohumeral joint.,,,
right glenohumeral moderate,There are moderate degenerative changes in the right glenohumeral joint.,,,
right glenohumeral severe,There are severe degenerative changes in the right glenohumeral joint.,,,
right hepatic cyst,There is a simple right lobe hepatic cyst.,,,
right hilar adenopathy,There are multiple enlarged nonspecific right hilar lymph nodes.,,,
right hip arthoplasty,There has been a right total hip arthroplasty.,,,
right hip mild,There are mild degenerative changes in the right hip joint.,,,
right hip moderate,There are moderate degenerative changes in the right hip joint.,,,
right hip severe,There are marked degenerative changes in the right hip joint.,,,
right inguinal,There is a nonobstructing right inguinal hernia.,,,
right kidney,The right kidney is normal.,,,
right kidney cyst,There is a simple cyst in the right kidney.,,,
right kidney infarct,"There is a focal cortical defect in the right kidney, consistent with remote infarction.",,,
Right kidney malrotation,The right kidney is malrotated.,,,
right kidney scar,"There is a focal cortical defect in the right kidney, representing remote infection or infarction.",,,
right knee arthroplasty,There has been a right knee arthroplasty with patellar resurfacing.,,,
right mastectomy,There has been a right mastectomy.,,,
right mastoidectomy,There has been a right mastoidectomy.,,,
right maxillary chronic,"There is diffuse mucoperiosteal thickening in the right maxillary sinus, consistent with chronic sinusitis.",,,
right nephrectomy,There is been a right nephrectomy.,,,
right ovarian cyst,There is a simple cyst in the right ovary.,,,
right ovarian polycystic,There are multiple simple right ovarian cysts.,,,
right ovary cyst,There is a simple cyst in the right ovary.,,,
right parapelvic,There are small benign right parapelvic cysts.,,,
right perinephric,There is inflammatory right perinephric stranding.,,,
right polycystic,There are multiple simple right renal cysts.,,,
right renal cortical,"There is a small focal cortical defect in the right kidney, representing remote infection or infarction.",,,
right renal cyst,There is a simple cyst in the right kidney.,,,
right renal polycystic,There are multiple simple right renal cysts.,,,
right renal scar,"There is a focal cortical defect in the right kidney, representing remote infection or infarction.",,,
right renal stent,There is a left ureteral stent with its coiled ends appropriately positioned in the right collecting system and bladder.,,,
right ribs healed,There are healed right rib fractures.,,,
right subcentimeter,"A subcentimeter hypodensity within the right kidney is too small to characterize, but statistically represents a renal cyst.",,,
right thalamus,"There is a focal hypodensity in the right thalamus, consistent with a remote lacunar infarction.",,,
right thyroid adenoma,"There is a focal hypodense lesion in the right thyroid lobe, consistent with a thyroid adenoma or carcinoma. Correlation with laboratory values and nuclear medicine scan is recommended if clinically warranted.",,,
shotty cervical,There are numerous prominent but non-pathologic lymph nodes in the neck. There are no nodes of pathologic dimensions.,,,
shotty inguinal,There are numerous prominent but non-pathologic lymph nodes in the inguinal regions. There are no nodes of pathologic dimensions.,,,
shotty mediastinal,There are numerous prominent but non-pathologic lymph nodes in the mediastinum. There are no nodes of pathologic dimensions.,,,
shotty mediastinum,There are numerous prominent but non-pathologic lymph nodes in the mediastinum. There are no nodes of pathologic dimensions.,,,
shotty mesenteric,There are multiple nonspecific nonpathologic but prominent lymph nodes in the mesentery. There are no mesenteric lymph nodes of pathologic dimensions.,,,
shotty mesentery,There are multiple nonspecific nonpathologic but prominent lymph nodes in the mesentery. There are no mesenteric lymph nodes of pathologic dimensions.,,,
shotty periaortic,There are multiple nonspecific nonpathologic but prominent lymph nodes in the periaortic region. There are no lymph nodes of pathologic dimensions.,,,
skeletal abdomen,"The spine, sacroiliac joints, and hip joints are normal.",,,
skeletal normal,The skeletal structures and soft tissues show no evidence of fracture or other acute processes.,,,
sleeve,The patient is post gastric sleeve surgery.,,,
sludge,The gallbladder demonstrates layering density consistent with noncalcified stones or sludge.,,,
spina bifida,There a benign spina bifida occulta.,,,
spleen calcifications,"The spleen demonstrates punctate calcifications, consistent with remote granulomatous organism exposure.",,,
spleen cyst,There is a simple splenic cyst.,,,
Spleen nonspecific,There are multiple splenic hypodensities that cannot be further characterized on the current examination.,,,
Spleen polycystic,There are multiple simple splenic cysts.,,,
splenectomy,There has been a splenectomy.,,,
Splenic Varices,There are small dilated perisplenic vessels consistent with varices.,,,
splenomegaly mild,There is mild nonspecific splenomegaly.,,,
splenomegaly moderate,There is moderate nonspecific splenomegaly.,,,
splenomegaly severe,There is marked nonspecific splenomegaly.,,,
splenule,An accessory splenule is noted adjacent to the spleen.,,,
splenule poly,Accessory splenules are noted adjacent to the spleen.,,,
sternotomy,There are sternal wires consistent with previous sternotomy incision.,,,
stool moderate,There is a moderate fecal load noted throughout the colon. Correlate for history of constipation.,,,
straightening,There is straightening of the normal cervical lordosis.,,,
