Macro Phrase,Macro Text,,,
Subcentimeter,"There are subcentimeter hypodensities in the bilateral kidneys, which are too small to characterize, but statistically represent renal cysts.",,,
subcentimeter hemorrhagic,"There are subcentimeter hypo-and hyperdensities in the bilateral kidneys, which are too small to characterize, but statistically represent renal cysts, some of which may be hemorrhagic.",,,
suboptimal PE,"Please note, the study is suboptimal for the evaluation of pulmonary embolism due to the lack of adequate contrast opacification within the pulmonary arteries.  The majority of the contrast is already within the aorta.  There is no filling defect within the main, right and left and proximal segmental branches of the pulmonary arteries.  The distal segmental and subsegmental branches cannot be evaluated on the study.",,,
suprapatellar large,A large suprapatellar joint effusion is present.,,,
suprapatellar moderate,A moderate suprapatellar joint effusion is present.,,,
suprapatellar small,A small suprapatellar joint effusion is present.,,,
tampon,A tampon is noted within the vaginal vault.,,,
right picc,A right peripherally inserted central venous catheter lies with its tip in the superior vena cava.,,,
Right subcentimeter many,"Subcentimeter hypodensities within the right kidney are too small to characterize, but statistically represents renal cysts.",,,
stool,There is extensive distenstion the rectosigmoid colon with a large internal fecal load. Consider disimpaction to prevent stercoral (pressure) colitis.,,,
thoracic mild,The thoracic spine demonstrates mild degenerative changes at multiple levels.,,,
thoracic moderate,The thoracic spine demonstrates moderate degenerative changes at multiple levels.,,,
thoracic severe,The thoracic spine demonstrates severe degenerative changes at multiple levels.,,,
total knee,There has been a total knee arthroplasty with patellar resurfacing.,,,
tracheostomy,A tracheostomy tube overlies the tracheal air column.,,,
tubal ligation,There has been a tubal ligation.,,,
ultrasonographic,Impression: Cholelithiasis without ultrasonographic evidence of cholecystitis.,,,
umbilical hernia,There is a fat-containing umbilical hernia.,,,
ureteral jets,Bilateral ureteral jets are identified.,,,
uterus,The uterus is normal.,,,
uterus atrophy,The uterus is atrophic but otherwise normal.,,,
uterus fibroid,"There is an irregular calcification in the myometrium, consistent with a benign degenerated fibroid tumor.",,,
uterus retroflexed,The uterus is retroflexed but otherwise normal.,,,
vascular calcs,Vascular calcifications are present.,,,
vascular mild,The vasculature demonstrates diffuse mild atherosclerotic calcification.,,,
vascular moderate,The vasculature demonstrates diffuse moderate atherosclerotic calcification.,,,
vascular scattered,The vasculature demonstrates scattered mild atherosclerotic calcification.,,,
vascular severe,The vasculature demonstrates diffuse extensive atherosclerotic calcification.,,,
Vicarious,There is vicarious gallbladder contrast excretion.,,,
mesentery,"Multiple nonspecific, nonpathologic, but prominent lymph nodes in the mesentery. No mesenteric lymph nodes of pathologic dimensions. Diffuse inflammatory stranding throughout the central mesentery as well. Findings are nonspecific, and most likely represent a viral adenitis. This &quot;misty mesentery&quot; can be an early manifestation of mesenteric lymphoma, however, and a follow up examination is recommended as clinically warranted.",,,
scars,"There are focal cortical defects in the bilateral kidneys, representing remote infection or infarction.
",,,
brain mild,"There are patchy areas of diminished attenuation seen within the periventricular and subcortical white matter compatible with mild chronic microvascular ischemic changes.There is diffuse cerebral atrophy present, consistent with this patient's age.There is no evidence of intracranial hemorrhage. There is no evidence of acute ischemia. There is no evidence of intracranial extra-axial fluid collections. There is no mass-effect or midline shift.",,,
low-grade,There are multiple fluid-filled loops of small bowel and colon noted throughout the abdomen and pelvis. There is no frank dilatation or obstruction. Findings are compatible with low grade enterocolitis.,,,
left picc,A left peripherally inserted central venous catheter lies with its tip in the superior vena cava.,,,
picc,A peripherally inserted central venous catheter lies with its tip in the superior vena cava.,,,
microvascular,"There are subcortical and periventricular white matter FLAIR hyperintensities, likely related to chronic microvascular ischemic disease.",,,
Bladder nonspecific,There is nonspecific bladder wall thickening. This may be related to incomplete distention versus mild cystitis. Correlate with urinalysis.,,,
diverticulosis moderate,Moderate diverticulosis is present in the sigmoid and descending colon.,,,
diverticulosis mild,Mild diverticulosis is present in the sigmoid and descending colon.,,,
Epiploic appendagitis,There is a focus of extraluminal inflammation with central fat density. This is consistent with acute epiploic appendagitis.  This is typically a self-limiting condition and responds well to NSAIDs.,,,
appendicitis severe,"The appendix demonstrates marked diffuse distention to approximately __ , consistent with acute appendicitis.  There is extensive periappendiceal inflammatory stranding.  No abscess. ",,,
gallbladder sludge,The gallbladder demonstrates layering density consistent with noncalcified stones or sludge.,,,
Patchy,"There are bilateral patchy groundglass airspace opacities, which are extending to the periphery.  This is in a pattern of distribution which can be seen with atypical pneumonia.  Consider testing. ",,,
Left subcentimeter many,"Subcentimeter hypodensities within the left kidney are too small to characterize, but statistically represents renal cysts.",,,
left subcentimeter hemorrhagic,"There is a subcentimeter hyperdensity within the left kidney, which is too small to characterize, but statistically represents a hemorrhagic or complex cyst. ",,,
right subcentimeter hemorrhagic,"There is a subcentimeter hyperdensity within the right kidney, which is too small to characterize, but statistically represents a hemorrhagic or complex cyst. ",,,